{
  "id": "PittMultiplayer",
  "name": "Pitt Multiplayer",
  "version": "0.2.2",
  "api_version": "^1.2",
  "entry": "main.gd",
  "load_order": 50,
  "provides": [
    "net"
  ],
  "extensions": [
    "extensions/main_menu_ext.gd",
    "extensions/upgrade_ui_ext.gd",
    "extensions/hole_ext.gd",
    "extensions/pause_menu_ext.gd",
    "extensions/grab/main_camera_grab_ext.gd",
    "extensions/gameplay/anomaly_ext.gd",
    "extensions/gameplay/anomaly_workbench_ext.gd",
    "extensions/gameplay/automatic_cash_workbench_ext.gd",
    "extensions/gameplay/automatic_duck_workbench_ext.gd",
    "extensions/gameplay/automatic_pinata_workbench_ext.gd",
    "extensions/gameplay/basketball_hoop_ext.gd",
    "extensions/gameplay/bottom_maw_ext.gd",
    "extensions/gameplay/bowling_pin_set_ext.gd",
    "extensions/gameplay/broom_ext.gd",
    "extensions/gameplay/camera_pivot_ext.gd",
    "extensions/gameplay/candy_ext.gd",
    "extensions/gameplay/cannon_ext.gd",
    "extensions/gameplay/card_reader_ext.gd",
    "extensions/gameplay/cash_register_ext.gd",
    "extensions/gameplay/debris_ext.gd",
    "extensions/gameplay/disco_ball_ext.gd",
    "extensions/gameplay/elevator_ext.gd",
    "extensions/gameplay/erasable_text_ext.gd",
    "extensions/gameplay/fail_safe_ext.gd",
    "extensions/gameplay/fan_ext.gd",
    "extensions/gameplay/fan_3_ext.gd",
    "extensions/gameplay/feed_camera_ext.gd",
    "extensions/gameplay/feed_screen_ext.gd",
    "extensions/gameplay/gambling_terminal_ext.gd",
    "extensions/gameplay/gate_power_generator_ext.gd",
    "extensions/gameplay/gate_shutters_ext.gd",
    "extensions/gameplay/gate_weight_plate_ext.gd",
    "extensions/gameplay/golden_duck_statue_ext.gd",
    "extensions/gameplay/golf_club_ext.gd",
    "extensions/gameplay/gravity_inverter_ext.gd",
    "extensions/gameplay/hud_ext.gd",
    "extensions/gameplay/interact_ray_ext.gd",
    "extensions/gameplay/keypad_button_ext.gd",
    "extensions/gameplay/loop_button_ext.gd",
    "extensions/gameplay/loop_puzzle_ext.gd",
    "extensions/gameplay/magnet_ext.gd",
    "extensions/gameplay/magnet_2_ext.gd",
    "extensions/gameplay/manual_cash_workbench_ext.gd",
    "extensions/gameplay/manual_pinata_workbench_ext.gd",
    "extensions/gameplay/minable_block_ext.gd",
    "extensions/gameplay/mining_ore_ext.gd",
    "extensions/gameplay/orbit_tool_ext.gd",
    "extensions/gameplay/ore_processor_ext.gd",
    "extensions/gameplay/pickaxe_ext.gd",
    "extensions/gameplay/pinata_ext.gd",
    "extensions/gameplay/piston_ext.gd",
    "extensions/gameplay/piston_2_ext.gd",
    "extensions/gameplay/piston_3_ext.gd",
    "extensions/gameplay/portal_ext.gd",
    "extensions/gameplay/press_ext.gd",
    "extensions/gameplay/proxy_intern_ext.gd",
    "extensions/gameplay/qa_arm_ext.gd",
    "extensions/gameplay/remote_ext.gd",
    "extensions/gameplay/roomba_ext.gd",
    "extensions/gameplay/security_keypad_ext.gd",
    "extensions/gameplay/shift_scheduler_ext.gd",
    "extensions/gameplay/speed_radar_ext.gd",
    "extensions/gameplay/spring_pad_ext.gd",
    "extensions/gameplay/stat_sign_ext.gd",
    "extensions/gameplay/terminal_control_ext.gd",
    "extensions/gameplay/torch_light_ext.gd",
    "extensions/gameplay/tractor_beam_ext.gd",
    "extensions/gameplay/uv_lamp_ext.gd",
    "extensions/gameplay/vacuum_ext.gd",
    "extensions/gameplay/vacuum_2_ext.gd",
    "extensions/gameplay/vertical_gate_ext.gd",
    "extensions/gameplay/metal_crate_ext.gd",
    "extensions/gameplay/plush_crate_ext.gd",
    "extensions/gameplay/anomaly_crate_ext.gd",
    "extensions/gameplay/wodd_crate_ext.gd",
    "extensions/gameplay/workbench_ext.gd",
    "extensions/gameplay/main_camera_interact_ext.gd"
  ],
  "game_versions": [
    "1.0.8"
  ],
  "multiplayer": "client_required",
  "description": "Steam co-op (MP2): friends-only lobbies and one shared, host-simulated world: every physics object, tool, machine and puzzle exists once and everyone sees it move; money, unlocks, phase and combos are shared; grab and throw with prediction; late join with a world snapshot."
}
