{
  "id": "PittMPTests",
  "name": "PittMultiplayer two-instance tests",
  "version": "0.1.0",
  "api_version": "^1.1",
  "entry": "main.gd",
  "load_order": 1100,
  "dependencies": {"PittMultiplayer": ">=0.1.0"},
  "game_versions": ["1.0.8"],
  "multiplayer": "local_only",
  "description": "Scripted host/client scenario over ENet localhost (tools/test-mp-loopback.ps1). Does nothing unless <pittapi dir>/mp_autotest.flag exists."
}
